{
  "schema_id": "cargo-allow.package-candidate.v2",
  "schema_version": 2,
  "topology_id": "CARGO-ALLOW-PKG-TOPOLOGY-V2-0001",
  "topology_digest": "sha256:15e45b4a4ac566bfdff34b3b83bc634d596c1d4c65cdd0056f95b87d2ab70ff9",
  "repository_commit": "0079ed138580328b1c66a45a3bc699fbcdd4aaed",
  "repository_tree": "d129784b82dd45d9db13939aab4414fce666d440",
  "cargo_lock_digest": "sha256:482d6c8ea702a15242e493568c89d96562ac1d52b9a30d122b6d29cdcfc7627e",
  "candidate_product_id": "cargo-allow-0.2",
  "root_logical_id": "cargo-allow",
  "root_package_name": "cargo-allow",
  "root_package_version": "0.2.0",
  "target_class": "cargo-allow-0.2",
  "feature_set_id": "default",
  "rows": [
    {
      "logical_id": "allow-core",
      "cargo_package_name": "allow-core",
      "cargo_package_version": "0.2.0",
      "rust_library_name": "allow_core",
      "workspace_source_path": "crates/allow-core",
      "product_family": "cargo-allow-0.2",
      "publication_state": "UnpublishedInternal",
      "publish": true,
      "support_tier": "supported",
      "release_order": 10,
      "selected_features": [],
      "expected_manifest_identity": "allow-core:0.2.0",
      "expected_dependency_rows": [
        {
          "package_name": "sha2",
          "package_version": "workspace",
          "dependency_kind": "external"
        },
        {
          "package_name": "unicode-normalization",
          "package_version": "workspace",
          "dependency_kind": "external"
        }
      ],
      "required_assets": []
    },
    {
      "logical_id": "allow-policy",
      "cargo_package_name": "allow-policy",
      "cargo_package_version": "0.2.0",
      "rust_library_name": "allow_policy",
      "workspace_source_path": "crates/allow-policy",
      "product_family": "cargo-allow-0.2",
      "publication_state": "UnpublishedInternal",
      "publish": true,
      "support_tier": "supported",
      "release_order": 20,
      "selected_features": [],
      "expected_manifest_identity": "allow-policy:0.2.0",
      "expected_dependency_rows": [
        {
          "package_name": "allow-core",
          "package_version": "0.2.0",
          "dependency_kind": "internal"
        },
        {
          "package_name": "serde",
          "package_version": "workspace",
          "dependency_kind": "external"
        },
        {
          "package_name": "sha2",
          "package_version": "workspace",
          "dependency_kind": "external"
        },
        {
          "package_name": "toml",
          "package_version": "workspace",
          "dependency_kind": "external"
        }
      ],
      "required_assets": []
    },
    {
      "logical_id": "allow-inventory",
      "cargo_package_name": "allow-inventory",
      "cargo_package_version": "0.2.0",
      "rust_library_name": "allow_inventory",
      "workspace_source_path": "crates/allow-inventory",
      "product_family": "cargo-allow-0.2",
      "publication_state": "UnpublishedInternal",
      "publish": true,
      "support_tier": "supported",
      "release_order": 30,
      "selected_features": [],
      "expected_manifest_identity": "allow-inventory:0.2.0",
      "expected_dependency_rows": [
        {
          "package_name": "allow-core",
          "package_version": "0.2.0",
          "dependency_kind": "internal"
        },
        {
          "package_name": "rayon",
          "package_version": "workspace",
          "dependency_kind": "external"
        },
        {
          "package_name": "serde",
          "package_version": "workspace",
          "dependency_kind": "external"
        },
        {
          "package_name": "serde_json",
          "package_version": "workspace",
          "dependency_kind": "external"
        },
        {
          "package_name": "toml",
          "package_version": "workspace",
          "dependency_kind": "external"
        }
      ],
      "required_assets": []
    },
    {
      "logical_id": "allow-files",
      "cargo_package_name": "allow-files",
      "cargo_package_version": "0.2.0",
      "rust_library_name": "allow_files",
      "workspace_source_path": "crates/allow-files",
      "product_family": "cargo-allow-0.2",
      "publication_state": "UnpublishedInternal",
      "publish": true,
      "support_tier": "supported",
      "release_order": 40,
      "selected_features": [],
      "expected_manifest_identity": "allow-files:0.2.0",
      "expected_dependency_rows": [
        {
          "package_name": "allow-core",
          "package_version": "0.2.0",
          "dependency_kind": "internal"
        },
        {
          "package_name": "yaml-rust2",
          "package_version": "0.13",
          "dependency_kind": "external"
        }
      ],
      "required_assets": []
    },
    {
      "logical_id": "allow-rust",
      "cargo_package_name": "allow-rust",
      "cargo_package_version": "0.2.0",
      "rust_library_name": "allow_rust",
      "workspace_source_path": "crates/allow-rust",
      "product_family": "cargo-allow-0.2",
      "publication_state": "UnpublishedInternal",
      "publish": true,
      "support_tier": "supported",
      "release_order": 50,
      "selected_features": [],
      "expected_manifest_identity": "allow-rust:0.2.0",
      "expected_dependency_rows": [
        {
          "package_name": "allow-core",
          "package_version": "0.2.0",
          "dependency_kind": "internal"
        },
        {
          "package_name": "rayon",
          "package_version": "workspace",
          "dependency_kind": "external"
        },
        {
          "package_name": "same-file",
          "package_version": "workspace",
          "dependency_kind": "external"
        },
        {
          "package_name": "toml",
          "package_version": "workspace",
          "dependency_kind": "external"
        },
        {
          "package_name": "tree-sitter",
          "package_version": "workspace",
          "dependency_kind": "external"
        },
        {
          "package_name": "tree-sitter-rust",
          "package_version": "workspace",
          "dependency_kind": "external"
        }
      ],
      "required_assets": []
    },
    {
      "logical_id": "allow-match",
      "cargo_package_name": "allow-match",
      "cargo_package_version": "0.2.0",
      "rust_library_name": "allow_match",
      "workspace_source_path": "crates/allow-match",
      "product_family": "cargo-allow-0.2",
      "publication_state": "UnpublishedInternal",
      "publish": true,
      "support_tier": "supported",
      "release_order": 60,
      "selected_features": [],
      "expected_manifest_identity": "allow-match:0.2.0",
      "expected_dependency_rows": [
        {
          "package_name": "allow-core",
          "package_version": "0.2.0",
          "dependency_kind": "internal"
        }
      ],
      "required_assets": []
    },
    {
      "logical_id": "allow-report",
      "cargo_package_name": "allow-report",
      "cargo_package_version": "0.2.0",
      "rust_library_name": "allow_report",
      "workspace_source_path": "crates/allow-report",
      "product_family": "cargo-allow-0.2",
      "publication_state": "UnpublishedInternal",
      "publish": true,
      "support_tier": "supported",
      "release_order": 70,
      "selected_features": [],
      "expected_manifest_identity": "allow-report:0.2.0",
      "expected_dependency_rows": [
        {
          "package_name": "allow-core",
          "package_version": "0.2.0",
          "dependency_kind": "internal"
        },
        {
          "package_name": "allow-policy",
          "package_version": "0.2.0",
          "dependency_kind": "internal"
        },
        {
          "package_name": "serde",
          "package_version": "workspace",
          "dependency_kind": "external"
        },
        {
          "package_name": "serde_json",
          "package_version": "workspace",
          "dependency_kind": "external"
        },
        {
          "package_name": "toml",
          "package_version": "workspace",
          "dependency_kind": "external"
        },
        {
          "package_name": "unicode-segmentation",
          "package_version": "workspace",
          "dependency_kind": "external"
        },
        {
          "package_name": "unicode-width",
          "package_version": "workspace",
          "dependency_kind": "external"
        }
      ],
      "required_assets": []
    },
    {
      "logical_id": "allow-policy-legacy",
      "cargo_package_name": "allow-policy-legacy",
      "cargo_package_version": "0.2.0",
      "rust_library_name": "allow_policy_legacy",
      "workspace_source_path": "crates/allow-policy-legacy",
      "product_family": "cargo-allow-0.2",
      "publication_state": "UnpublishedInternal",
      "publish": true,
      "support_tier": "supported",
      "release_order": 75,
      "selected_features": [],
      "expected_manifest_identity": "allow-policy-legacy:0.2.0",
      "expected_dependency_rows": [
        {
          "package_name": "allow-core",
          "package_version": "0.2.0",
          "dependency_kind": "internal"
        },
        {
          "package_name": "allow-files",
          "package_version": "0.2.0",
          "dependency_kind": "internal"
        },
        {
          "package_name": "allow-policy",
          "package_version": "0.2.0",
          "dependency_kind": "internal"
        },
        {
          "package_name": "toml",
          "package_version": "workspace",
          "dependency_kind": "external"
        }
      ],
      "required_assets": []
    },
    {
      "logical_id": "repo-protocol",
      "cargo_package_name": "effortless-repo-protocol",
      "cargo_package_version": "0.1.0",
      "rust_library_name": "effortless_repo_protocol",
      "workspace_source_path": "crates/effortless-repo-protocol",
      "product_family": "shared-0.1",
      "publication_state": "UnpublishedInternal",
      "publish": true,